{
  "schema_version": "1.0.0",
  "declaration_id": "data-path-audit-synthetic-001",
  "tenant_id": "tenant-synthetic-alpha",
  "workload_id": "workload-inference-synthetic",
  "revision": 1,
  "data_origin": "synthetic",
  "declared_at": "2026-10-22T10:00:00.000Z",
  "data_categories": [
    {
      "category_id": "model_input",
      "classification": "confidential"
    },
    {
      "category_id": "model_output",
      "classification": "confidential"
    }
  ],
  "ordered_region_ids": [
    "cn-shanghai-edge",
    "cn-shanghai-compute",
    "sg-singapore-observe"
  ],
  "regions": [
    {
      "region_id": "cn-shanghai-compute",
      "jurisdiction_code": "CN-SH",
      "provider": "Synthetic Compute Provider",
      "provider_region": "cn-shanghai-synthetic",
      "roles": [
        "processing"
      ]
    },
    {
      "region_id": "cn-shanghai-edge",
      "jurisdiction_code": "CN-SH",
      "provider": "Synthetic Edge Provider",
      "provider_region": "cn-shanghai-edge-synthetic",
      "roles": [
        "origin"
      ]
    },
    {
      "region_id": "sg-singapore-observe",
      "jurisdiction_code": "SG",
      "provider": "Synthetic Observability Provider",
      "provider_region": "sg-singapore-synthetic",
      "roles": [
        "destination",
        "storage"
      ]
    }
  ],
  "boundaries": [
    {
      "boundary_id": "boundary-edge-compute",
      "from_region_id": "cn-shanghai-edge",
      "to_region_id": "cn-shanghai-compute",
      "boundary_types": [
        "network_zone",
        "tenant"
      ],
      "cross_jurisdiction": false,
      "transfer_basis_ref": null
    },
    {
      "boundary_id": "boundary-compute-observe",
      "from_region_id": "cn-shanghai-compute",
      "to_region_id": "sg-singapore-observe",
      "boundary_types": [
        "jurisdiction",
        "provider"
      ],
      "cross_jurisdiction": true,
      "transfer_basis_ref": "basis-synthetic-cross-border-001"
    }
  ],
  "encryption": {
    "in_transit": {
      "required": true,
      "protocols": [
        "mtls-1.3"
      ],
      "termination": "end-to-end",
      "plaintext_exception_refs": []
    },
    "at_rest": {
      "required": true,
      "algorithms": [
        "aes-256-gcm"
      ],
      "key_control": "tenant",
      "key_reference": "keyref-synthetic-001"
    }
  },
  "processors": [
    {
      "processor_id": "processor-controller",
      "legal_name": "Synthetic Workload Controller",
      "role": "controller",
      "purposes": [
        "inference-request"
      ],
      "data_category_ids": [
        "model_input",
        "model_output"
      ],
      "region_ids": [
        "cn-shanghai-edge"
      ],
      "parent_processor_id": null,
      "agreement_ref": null
    },
    {
      "processor_id": "processor-inference",
      "legal_name": "Synthetic Inference Processor",
      "role": "processor",
      "purposes": [
        "model-inference"
      ],
      "data_category_ids": [
        "model_input",
        "model_output"
      ],
      "region_ids": [
        "cn-shanghai-compute"
      ],
      "parent_processor_id": null,
      "agreement_ref": "agreement-synthetic-processor-001"
    },
    {
      "processor_id": "processor-observe",
      "legal_name": "Synthetic Observability Subprocessor",
      "role": "subprocessor",
      "purposes": [
        "aggregate-observability"
      ],
      "data_category_ids": [
        "model_output"
      ],
      "region_ids": [
        "sg-singapore-observe"
      ],
      "parent_processor_id": "processor-inference",
      "agreement_ref": "agreement-synthetic-subprocessor-001"
    }
  ],
  "declaration_fingerprint": "sha256:3c5a678a9b55245b68dc1a0572dfa99e2f941bc97c271870461d54f70dc58427"
}
